936,1507H7364636,环卫市容,跨门营业,"反映该处商铺有跨门营业现象,并在人行道上搭建帐篷,多次联系当地城管,工作人员不做任何处理,对此强烈不满，请处理并回复。",7345.695811,-12627.88277,2015-7-27 17:06,2015-7-27 17:10,2015-7-27 17:10,2015-7-31 9:08,12319上报,上南路6401号(起程汽车维修)
937,1508H7479855,街面秩序,占道无证照经营,【无需回复】反映该处有无证洗车摊位，请核实处理。（信息保密，无需回复）,5659.857314,-7415.500424,2015-8-4 15:36,2015-8-4 15:43,2015-8-4 15:43,2015-8-6 15:32,12319上报,板泉路整条路
938,1508H7529890,街面秩序,占道无证照经营,反映该处每天05：00到07：00有几十个乱设摊卖早点现象，影响市容及交通，城管部门在现场未进行任何处理，请核实处理并回复。,13835.00689,-10591.86683,2015-8-7 9:32,2015-8-7 9:38,2015-8-7 9:38,2015-8-12 15:31,12319上报,康桥镇秀沿路3668号门前
939,1507H7429454,街面秩序,占道无证照经营,【信息保密，无需回复】反映上述地址每天17：00左右开始有大量设摊现象，影响通行，请尽快核实处理。（信息保密）,17444.93051,-13918.7492,2015-7-31 15:36,2015-7-31 15:38,2015-7-31 15:38,2015-8-5 10:10,12319上报,周祝公路建设路口
940,1508H7436561,街面秩序,占道无证照经营,反映该处马路两侧有人设摊搞活动买电动车，请核实处理回复。,7024.132163,-7271.783944,2015-8-1 14:41,2015-8-1 14:48,2015-8-1 14:48,2015-8-5 15:14,12319上报,下南路161弄门口到南新居委会
941,1508H7436605,街面秩序,占道无证照经营,反映该处每天21:00--凌晨05:00存有夜排档设摊，请尽快核实处理并回复。联系电话：58512158,8153.649508,2338.871777,2015-8-1 14:47,2015-8-1 14:53,2015-8-1 14:53,2015-8-6 15:31,12319上报,德平路25弄门口
942,1508H7482220,环卫市容,跨门营业,反映该处现有一个烧烤摊跨门营业，请核实处理。（信息保密，无需回复。）,2942.227519,-7738.298153,2015-8-4 20:42,2015-8-4 20:49,2015-8-4 20:49,2015-8-6 15:33,12319上报,杨思路洪山路
943,1508H7482552,街面秩序,占道无证照经营,反映该处现在有设摊现象，影响生活，请核实处理并回复,3730.622112,-3925.771077,2015-8-5 0:36,2015-8-5 0:40,2015-8-5 0:40,2015-8-7 15:51,12319上报,浦东南路胶南路
944,1508H7503178,街面秩序,占道无证照经营,反映该处有大量乱设摊，占用道路影响通行，对此表示不满，请核实处理并回复。,36378.82999,-41926.24822,2015-8-6 7:35,2015-8-6 7:38,2015-8-6 7:38,2015-8-7 13:46,12319上报,渔港路466号门口
945,1508H7503179,街面秩序,占道无证照经营,反映该处正有大量设摊，严重影响车辆通行，对此强烈不满，请处理并回复。,10708.00733,12620.83569,2015-8-6 7:35,2015-8-6 7:42,2015-8-6 7:42,2015-8-7 10:45,12319上报,高桥镇学后街（高桥菜场门口）
946,1508H7432297,街面秩序,占道无证照经营,反映上述地址现有大量乱设摊现象（今天的设摊比前几天翻一翻），影响市容和通行，请尽快核实处理并回复。,0,0,2015-8-1 5:30,2015-8-1 6:16,2015-8-1 6:16,2015-8-1 9:24,12319上报,向阳路234号
947,1508H7435932,环卫市容,暴露垃圾,（催办）反映该处建筑工地擅自将泥浆排在道路上，影响市容通行，请尽快联系处理。,0,0,2015-8-1 11:53,2015-8-1 11:59,2015-8-1 11:59,2015-8-6 10:21,12319上报,江镇路靠近物流大道
948,1508H7437978,街面秩序,占道无证照经营,反映上述地址现有乱设摊现象（排挡、烧烤），请尽快核实处理。,3256.739487,-8309.053737,2015-8-1 22:23,2015-8-1 22:25,2015-8-1 22:25,2015-8-4 7:34,12319上报,海阳路洪山路
949,1508H7438420,街面秩序,占道无证照经营,反映上述地址现有大量乱设摊现象（今天的设摊比前几天翻一翻），影响市容和通行，请尽快核实处理并回复。,26891.39487,-20727.63135,2015-8-2 5:23,2015-8-2 5:25,2015-8-2 5:25,2015-8-5 9:53,12319上报,向阳路234号
950,1508H7440813,环卫市容,跨门营业,"反映该处烧烤店每天18:00分左右开始有跨门经营,影响市容,请核实处理并回复。联系电话:13661541217",6066.465922,-7634.760169,2015-8-2 9:35,2015-8-2 9:39,2015-8-2 9:39,2015-8-4 7:36,12319上报,东书房路390弄北侧
951,1508H7432252,街面秩序,占道无证照经营,反映该处现在有10多个乱设摊（卖烧烤和炒面，每天20:00开始有），影响市容通行及周边居民生活，请速核实处理。（信息保密，不需回复）,0,0,2015-8-1 4:36,2015-8-1 6:13,2015-8-1 9:22,2015-8-4 13:49,12319上报,三林路靠近灵岩南路
952,1508H7448410,街面秩序,占道无证照经营,（信息保密，不回复）反映该处绿化带内每天07:00至09:00有卡车设摊卖早点，影响市容。反映后迟迟未处理，对此不满，请尽快核实处理。,11754.67076,-3326.147365,2015-8-3 8:48,2015-8-3 8:53,2015-8-3 8:53,2015-8-5 14:10,12319上报,祖冲之路藿香路
953,1508H7435504,街面秩序,占道无证照经营,反映该处现有一个面包车乱设摊卖西瓜现象，影响市容及居民出行，并且城管部门在现场却未进行任何处理，请处理并回复。,9361.787084,12891.59802,2015-8-1 10:24,2015-8-1 10:34,2015-8-1 10:34,2015-8-5 16:38,12319上报,高桥镇和龙路农贸市场旁边
954,1508H7436201,环卫市容,跨门营业,【信息保密，无需回复】反映该处每天06:00-17：00左右有大量跨门营业卖凉菜、早点现象，影响市容及居民出行，请处理。（信息保密，无需回复）,0,0,2015-8-1 13:35,2015-8-1 13:53,2015-8-1 13:53,2015-8-5 9:25,12319上报,创新西路前进村门口
955,1508H7440442,街面秩序,占道无证照经营,（信息保密，无需回复。）反映该处每天09:00不到至18:00有设摊现象，喇叭噪音扰民，请处理。,11753.68631,3615.253474,2015-8-2 9:05,2015-8-2 9:08,2015-8-2 9:08,2015-8-3 10:09,12319上报,菏泽路567弄内
956,1508H7437240,街面秩序,占道无证照经营,反映该处现有4~5辆卡车设摊卖西瓜，请核实处理并回复。,25639.66405,-4965.388582,2015-8-1 16:47,2015-8-1 17:02,2015-8-1 17:02,2015-8-3 14:25,12319上报,川南奉公路灵通路
957,1508H7437566,环卫市容,跨门营业,反映该店铺有每天16:00以后有跨门营业卖烧烤现象，影响周边居民生活，请核实处理并回复。,2942.227519,-7738.298153,2015-8-1 18:41,2015-8-1 18:45,2015-8-1 18:45,2015-8-4 7:34,12319上报,杨思路洪山路路口（老四烧烤店）
958,1508H7437593,街面秩序,占道无证照经营,反映该处有乱设摊现象。（二十个摊位左右），请核实处理并回复。,21433.32958,-3562.483365,2015-8-1 18:47,2015-8-1 18:51,2015-8-1 18:51,2015-8-4 15:19,12319上报,川沙路川沙广场
959,1508H7437625,街面秩序,占道无证照经营,反映上述地址每天18：30左右开始有大量乱设摊现象，占道设摊，影响道路通行，对此表示不满，请速核实处理。,10473.5801,1941.100032,2015-8-1 18:59,2015-8-1 19:05,2015-8-1 19:05,2015-8-6 16:24,12319上报,金杨路630号门口
960,1508H7437843,街面秩序,占道无证照经营,反映上述地址有乱设摊现象（卖水果、糖果），占道设摊，影响道路通行，对此表示不满，请速核实处理。,11288.91633,-10763.18406,2015-8-1 20:47,2015-8-1 20:52,2015-8-1 20:52,2015-8-5 14:19,12319上报,秀沿路靠近康新公路（联华超市门口）
961,1508H7437844,环卫市容,暴露垃圾,反映上述地址路面有垃圾占道（家用电器），反映人再次来电表示投诉后垃圾一直没有清理，对此表示不满，请速核实处理。（信息保密，无需回复）,5881.200962,-7453.606665,2015-8-1 20:47,2015-8-1 20:51,2015-8-1 20:51,2015-8-5 9:04,12319上报,三林镇板泉路66号（浦三路到杨高南路）
962,1507H7423591,街面秩序,占道无证照经营,【无需回复】反映该处每天06:30以前就开始有大量乱设摊现象，严重影响车辆通行。多次反映未得到改善，对此表示不满，请核实处理。（无需回复，信息保密，反映人表示该处可能属闵行与浦东新区交界处）,0,0,2015-7-31 9:42,2015-7-31 9:43,2015-7-31 9:43,2015-7-31 16:49,12319上报,浦星公路芦恒路由北向南（地铁口附近）
963,1507H7423839,街面秩序,占道无证照经营,反映该处每天07:00不到至18:30有设摊现象（面包车卖大米、贩卖纸币），双休日还有设摊卖活禽，影响周边居民，对此不满，请处理并回复。,11753.68631,3615.253474,2015-7-31 9:48,2015-7-31 9:51,2015-7-31 9:51,2015-7-31 14:41,12319上报,菏泽路567弄内
964,1508H7437865,环卫市容,跨门营业,反映该处现在有跨门营业现象，反映至今未果，后有相关部门给其电话称会至现场处理，但至今相关部门没到现场查实，对此不满，请核实处理并回复。,6066.465922,-7634.760169,2015-8-1 21:05,2015-8-1 21:13,2015-8-1 21:13,2015-8-4 7:35,12319上报,东书房路390弄北面
965,1508H7441923,环卫市容,跨门营业,（信息保密）反映该处07月26--08月01日都有跨门营业现象（烧烤），请核实处理。（信息保密）,2645.227551,-8167.246665,2015-8-2 13:47,2015-8-2 14:04,2015-8-2 14:04,2015-8-4 7:35,12319上报,板泉路915号（刘氏龙虾）
966,1507H7431916,街面秩序,占道无证照经营,反映该处现有乱设摊现象（每天21:30---02:30，一个夜排档摊位），油烟扰民，对此不满，请尽快核实处理并回复。,0,0,2015-7-31 22:11,2015-7-31 22:41,2015-7-31 22:41,2015-8-5 10:00,12319上报,锦安东路近169路终点站
967,1508H7432151,街面秩序,占道无证照经营,反映该处每天20:00~次日02:00有10个左右乱设摊（卖烧烤和炒面），影响市容及居民出行，请速核实处理。（信息保密，不需回复）,0,0,2015-8-1 2:17,2015-8-1 4:00,2015-8-1 9:20,2015-8-4 13:49,12319上报,三林路靠近灵岩南路
968,1507H7417183,街面秩序,占道无证照经营,反映上述地址有设摊播放高音喇叭（卡拉OK收费），影响居民生活，请有关部门尽快处理并回复。,3117.976754,-12233.6564,2015-7-30 20:29,2015-7-30 20:32,2015-7-30 20:32,2015-8-3 13:56,12319上报,三舒路三鲁公路
969,1508H7438718,街面秩序,占道无证照经营,反映上述地址现有大量乱设摊现象，占道设摊，影响道路通行，对此表示不满，请速核实处理。,25181.07423,-28823.30214,2015-8-2 6:59,2015-8-2 7:05,2015-8-2 7:05,2015-8-4 10:18,12319上报,大团镇永春西路
970,1507H7417744,街面秩序,占道无证照经营,反映上述地址现有大量乱设摊现象（今天的设摊比前几天翻一翻），影响市容和通行，请尽快核实处理并回复。,26891.39487,-20727.63135,2015-7-31 5:47,2015-7-31 7:04,2015-7-31 7:04,2015-7-31 16:24,12319上报,向阳路234号
971,1507H7430840,街面秩序,占道无证照经营,"反映该处每天15:00左右开始有乱设摊现象(20个摊位),影响交通,请核实处理并回复.",0,0,2015-7-31 16:41,2015-7-31 16:49,2015-7-31 16:49,2015-8-5 9:42,12319上报,牛路胡家路(顾路菜场)
972,1507H7430841,街面秩序,占道无证照经营,反映该处14：00--24：00有大量乱设摊现象（烧烤摊），影响通行，多次反映至今未得到改善，也未给予回复，对此表示不满，请核实处理并回复。,2001.055166,-6607.141672,2015-7-31 16:41,2015-7-31 16:47,2015-7-31 16:47,2015-8-5 16:02,12319上报,昌里路历城路
973,1507H7430842,街面秩序,占道无证照经营,（反映人表示该问题无人答复，要求尽快回复）反映该处有乱设摊现象，影响行人通行，要求取缔，请核实处理并回复。联系电话：18521388169,2654.265759,-6329.348743,2015-7-31 16:41,2015-7-31 16:49,2015-7-31 16:49,2015-8-4 13:53,12319上报,洪山路蔓趣公园正门对面
974,1507H7417045,环卫市容,跨门营业,（来电要求催办，并要求上级部门处理）反映上述地址有扩门经营把影响机放在门外（立新炸鸡排店），影响居民生活，请有关部门尽快处理并回复。,0,0,2015-7-30 19:23,2015-7-30 19:27,2015-7-30 19:27,2015-7-31 16:22,12319上报,惠南镇东门大街三八路口
975,1508H7442972,环卫市容,暴露垃圾,反映该处公交车站有个垃圾桶，距离站牌很近，并且周边居民也会将垃圾堆到该处，气味严重影响乘客，希望移位，请核实处理并回复。（该处车站有992路、715路、南川线停靠，联系方式：13661979190）,4680.867201,-5951.638311,2015-8-2 17:41,2015-8-2 18:11,2015-8-2 18:11,2015-8-5 10:12,12319上报,北艾路杨高南路（往沪南公路方向）
976,1508H7443450,环卫市容,跨门营业,反映该处现在有跨门营业现象，反映至今未果，后有相关部门给其电话称会至现场处理，但至今相关部门没到现场查实，对此不满，请核实处理并回复。,6057.399874,-7552.169993,2015-8-2 19:53,2015-8-2 20:09,2015-8-2 20:09,2015-8-4 7:36,12319上报,东书房路356号
977,1508H7588512,街面秩序,占道无证照经营,（信息保密，不需回复）反映该处每天15:00~21:00有一个乱设摊（卖菜的），影响市容及居民出行，请速核实处理。,20641.23069,5896.954679,2015-8-11 14:57,2015-8-11 15:00,2015-8-11 15:00,2015-8-13 10:14,12319上报,东川公路靠近秦家港路
978,1508H7594146,街面秩序,占道无证照经营,【无需回复】反映该处每天07:15--08:30有乱设摊（有八辆卡车卖西瓜），影响车辆通行，反映后未有城管到场，对此不满，反映人情绪激动，请处理。（信息保密，无需回复）,0,0,2015-8-12 7:26,2015-8-12 7:38,2015-8-12 7:38,2015-8-17 9:50,12319上报,金闻路100号
979,1508H7547667,街面秩序,占道无证照经营,（催办）反映该处现正有三四个乱设摊（烧烤和炒面），影响市容和通行，要求相关部门立即到达现场，望处理并回复。,12967.39319,3406.607202,2015-8-8 21:02,2015-8-8 21:27,2015-8-8 21:27,2015-8-10 15:08,12319上报,金高路靠近佳高路
980,1508H7464459,街面秩序,占道无证照经营,反映上述地址06:00有大量乱设摊现象（卖活禽），影响出行，请核实处理。,0,0,2015-8-4 7:26,2015-8-4 7:28,2015-8-4 7:28,2015-8-6 9:34,12319上报,迎春路金松路
981,1508H7537550,环卫市容,跨门营业,反映上述地址的锦鑫海鲜夜间跨门营业，影响周围居民，请尽快核实处理并回复。【（质协回访）反映人表示处置部门未联系他，要求三林镇城管要加强执法，把电话记录下来，要做好工作。】,2821.567327,-8097.855817,2015-8-7 15:32,2015-8-7 16:02,2015-8-7 16:02,2015-8-10 17:36,12319上报,板泉路977号
982,1508H7537551,环卫市容,跨门营业,反映该处有跨门营业现象（中午到凌晨5点，冰箱和棚子一直放置在外），其称投诉两个月一直没有人处理过，城管给其答复称历史遗留问题，对此回复不满，请核实处理并回复。【（质协回访回访）经回访，反映人表示问题未解决，对此不满，请核实处理并回复。 】,3707.977321,-12432.53546,2015-8-7 15:32,2015-8-7 16:32,2015-8-7 16:32,2015-8-11 14:27,12319上报,林恒路1191号
983,1508H7537553,街面秩序,占道无证照经营,反映该处每天22:30--03:00左右有乱设摊现象（夜排档），油烟扰民，请速核实处理并回复。【（质协回访）问题还是没有解决，城管惩罚力度不够，城管就说会去处理的，但是如果只是罚点小钱的话，罚了之后小贩还是会照样乱设摊。】,5691.580226,-2382.301988,2015-8-7 15:32,2015-8-7 16:05,2015-8-7 16:05,2015-8-11 15:35,12319上报,蓝村路55弄
984,1508H7552000,街面秩序,占道无证照经营,【无需回复】反映上述地址现有乱设摊现象（5个摊位），占道设摊，影响道路通行，对此表示不满，请速核实处理。（信息保密，无需回复）,0,0,2015-8-9 12:21,2015-8-9 12:24,2015-8-9 12:24,2015-8-12 15:38,12319上报,南六公路野生动物园门口
985,1508H7541249,街面秩序,占道无证照经营,反映该处每天05:30---07:00有大量乱设摊，严重影响周边环境，之前联系康桥城管要求提前上班，接电人员态度恶劣，且挂反映人电话，反映人也打听过城管人员是随叫随到，没有上班时间，对此表示不满，请联系处理并回复。,0,0,2015-8-8 7:02,2015-8-8 7:16,2015-8-8 7:16,2015-8-12 15:34,12319上报,康汇路靠近康恩路
986,1508H7501537,街面秩序,占道无证照经营,反映该处每天18:00至19:00有乱设摊现象（一个摊位卖活禽），请核实处理并回复。联系电话：136519705189,1307.629982,-7383.95508,2015-8-5 20:11,2015-8-5 20:16,2015-8-5 20:16,2015-8-10 11:41,12319上报,德州路420弄近西营路小区门口
987,1508H7521393,环卫市容,跨门营业,（信息保密不需回复）反映该处店面存在跨门营业的问题（三、四家店均有跨门营业，将凳子放在店外），影响居民生活，反映人再次来电表示在反映过后未见有任何改善，请核实处理。,6637.624227,954.5453753,2015-8-6 20:56,2015-8-6 20:57,2015-8-6 20:57,2015-8-12 8:20,12319上报,栖山路民生路（龙虾店）
988,1508H7482182,街面秩序,占道无证照经营,反映该处每天17：00点开始有设摊现象，影响出行，请核实处理并回复。,27171.8805,-9936.263915,2015-8-4 20:24,2015-8-4 20:25,2015-8-4 20:25,2015-8-10 10:05,12319上报,祝桥镇施镇路靠近航城五路
989,1508H7533922,街面秩序,占道无证照经营,反映该处每天14:30-19:00有几十个无证设摊现象（贩卖种类多），影响市容和周边居民生活。故望相关部门尽快核实处理并回复。,0,0,2015-8-7 11:32,2015-8-7 11:45,2015-8-7 11:45,2015-8-10 14:29,12319上报,周祝公路2657号靠近智源小学
990,1508H7563803,街面秩序,占道无证照经营,（信息保密，无需回复）反映该处每天全天候有大面积乱设摊现象，严重影响居民生活的，对此不满，称其之前有投诉过多次，但一直没有改善，称该处乱设摊就和城管躲猫猫，城管也是车开过来走个过场，希望能像以前开世博时有专项整治，起码能看到改善，请核实处理。（信息保密，无需回复）,20034.03435,3099.735777,2015-8-10 10:03,2015-8-10 10:06,2015-8-10 10:06,2015-8-12 8:56,12319上报,龚新路龚路支路到龚华路
991,1508H7535619,街面秩序,占道无证照经营,反映该处有大量乱设摊，占用道路影响通行，对此表示不满，请速核实处理。【（质协回访）经回访，反映人表示没有长效处理机制，好了一两天又不好了。 】,10280.62186,4455.276835,2015-8-7 14:08,2015-8-7 15:19,2015-8-7 15:19,2015-8-10 17:34,12319上报,莱阳路201弄
992,1508H7535622,环卫市容,暴露垃圾,反映上述地址存在大量建筑垃圾堆积，影响市容，请核实处理并回复。【反映上述地址存在大量建筑垃圾堆积，影响市容，请核实处理并回复。 】,7415.585507,802.6061752,2015-8-7 14:08,2015-8-7 15:23,2015-8-7 15:23,2015-8-10 17:32,12319上报,洋泾镇路10号
993,1508H7545922,街面秩序,占道无证照经营,反映该处现在存在一个乱设摊买泳装，请联系处理。,274.1220767,-8413.896041,2015-8-8 14:02,2015-8-8 14:06,2015-8-8 18:22,2015-8-11 16:52,12319上报,泳耀路50号门口
994,1508H7553952,环卫市容,跨门营业,反映上述地址商铺现有跨门营业现象，占道摆放高音喇叭叫卖，影响周边居民生活，对此表示不满，请速核实处理并回复。,7175.324323,-5364.499879,2015-8-9 19:09,2015-8-9 19:11,2015-8-9 19:11,2015-8-12 16:19,12319上报,莲园路博华路路口（鲜果批发行）
995,1508H7500434,街面秩序,占道无证照经营,反映该处每天不定时有1个乱设摊修理车子敲打铁皮现象，影响市容及居民出行，请处理并回复。,4160.840736,-2454.718756,2015-8-5 16:36,2015-8-5 16:46,2015-8-5 16:46,2015-8-6 12:30,12319上报,塘桥新路175号
996,1508H7540058,街面秩序,占道无证照经营,反映该处每天有10个乱设摊（路边摊），请核实处理并回复。,10163.75786,2862.976257,2015-8-7 19:56,2015-8-7 20:13,2015-8-7 20:13,2015-8-10 12:54,12319上报,金桥路835弄门口
997,1508H7457721,街面秩序,占道无证照经营,此单为网上投诉，反映该处有大量设摊，影响通行，请处理。,0,0,2015-8-3 13:50,2015-8-3 14:14,2015-8-3 14:14,2015-8-4 15:45,12319上报,川沙路川沙广场（先行联系川沙路新源路）
998,1508H7500745,街面秩序,占道无证照经营,【无需回复】反映该处每天17:00~22:00有10个左右乱设摊（大卡车卖水果），影响市容及居民出行，请速核实处理,14198.64795,6351.892264,2015-8-5 17:00,2015-8-5 17:08,2015-8-5 17:31,2015-8-7 9:00,12319上报,高宝路靠近金京路
999,1508H7494124,环卫市容,跨门营业,【信息保密，无需回复】反映该店铺每天19:00到次日04:00有跨门营业现象（991号潮汕牛肉火锅店外炒菜并将桌椅放在店外），影响市容及周边居民生活。边上店铺也有跨门营业情况，反映后迟迟未见处理，对此不满，请尽快核实处理。（信息保密，无需回复）,2858.069183,-8083.975881,2015-8-5 10:30,2015-8-5 10:31,2015-8-5 10:31,2015-8-6 15:34,12319上报,板泉路991号(潮汕牛肉火锅)
1000,1508H7494125,环卫市容,跨门营业,反映该处每天16：00之后有跨门营业现象（烧烤），多次反映未得到改善，请尽快核实处理。（信息保密）,2645.227551,-8167.246665,2015-8-5 10:30,2015-8-5 10:30,2015-8-5 10:30,2015-8-6 15:34,12319上报,板泉路915号（刘氏龙虾）
1001,1508H7494126,环卫市容,跨门营业,【信息保密，无需回复】反映该19:00~次日04:00有跨门营业现象，影响周边居民生活，请核实处理。（信息保密，不需回复）,2858.667359,-8083.771529,2015-8-5 10:30,2015-8-5 10:31,2015-8-5 10:31,2015-8-6 15:35,12319上报,板泉路993号
1002,1508H7553560,街面秩序,占道无证照经营,【信息保密，无需回复】反映该处每天晚上乱设摊严重，影响市容，请联系处理。信息保密。,22816.99688,1989.617888,2015-8-9 16:57,2015-8-9 16:59,2015-8-9 16:59,2015-8-12 8:37,12319上报,东川公路胜利路
1003,1508H7584313,街面秩序,占道无证照经营,（信息保密，无需回复。）反映该处每天18:00--3:00有一个乱设摊现象（一个烧烤摊），请核实处理。（信息保密，无需回复。）,7195.495331,-1406.614691,2015-8-11 11:15,2015-8-11 11:24,2015-8-11 11:24,2015-8-12 15:35,12319上报,迎春路千味拉面门口（水清木华小区旁）
1004,1508H7522770,街面秩序,占道无证照经营,（信息保密，无需回复）反映该处现在有早餐摊位，影响车辆通行，请处理。,28881.52261,-13174.10327,2015-8-7 7:32,2015-8-7 7:34,2015-8-7 7:34,2015-8-7 9:07,12319上报,祝桥镇金闻路100号
1005,1508H7554362,街面秩序,占道无证照经营,反映该处现在有七八个夜排档（每晚22:00以后），影响市容，反映人自称是联防队里开巡逻车，没有办法进行阻止，请核实处理。（信息保密，无需回复）,0,0,2015-8-9 23:15,2015-8-9 23:52,2015-8-9 23:52,2015-8-12 14:12,12319上报,张江镇孙耀路靠近华夏路
1006,1508H7572478,街面秩序,占道无证照经营,（信息保密，无需回复）反映上述地址现有大量设摊现象，影响市民通行，请尽快核实处理。（信息保密，无需回复）,8724.138405,-4826.093574,2015-8-10 17:51,2015-8-10 17:55,2015-8-10 17:57,2015-8-13 16:10,12319上报,高科西路申波路
1007,1508H7591476,街面秩序,占道无证照经营,"反映该处每天07:00至08:00,17:00至18:00左右有乱设摊现象(厢式货车卖菜),影响交通,请核实处理并回复.",21562.05893,4378.225635,2015-8-11 16:33,2015-8-11 16:48,2015-8-11 16:48,2015-8-13 10:29,12319上报,秦家港路东川公路
1008,1508H7591884,街面秩序,占道无证照经营,"反映该处每天07:00到08:30,16:30到17:30，19：30到20：30有几十个乱设摊卖百货现象，该问题反映后，城管已到场未处理，影响市容及居民出行，请处理并回复。",0,0,2015-8-11 17:03,2015-8-11 17:07,2015-8-11 17:07,2015-8-17 9:49,12319上报,金闻路100号
1009,1508H7539405,街面秩序,占道无证照经营,（信息保密，不需回复）反映该处每天15:00--23:00左右有大量乱设摊卖小吃现象，影响市容及居民出行，请处理。（信息保密，不需回复）,0,0,2015-8-7 17:20,2015-8-7 17:28,2015-8-7 17:28,2015-8-11 14:12,12319上报,康桥镇花墙村村委会路口
1010,1508H7558472,环卫市容,暴露垃圾,【与诉求人先行联系其表示，该处为宣桥镇】反映该处有大量建筑垃圾，请核实处理并回复。13564031588,0,0,2015-8-10 8:51,2015-8-10 10:10,2015-8-10 10:10,2015-8-13 9:22,12319上报,宣桥镇真北路光明三村
1011,1508H7544933,街面秩序,占道无证照经营,【无需回复】反映上述地址现有乱设摊现象，占道设摊，影响道路通行，对此表示不满，请速核实处理。,20809.52053,-7669.786249,2015-8-8 11:08,2015-8-8 11:16,2015-8-8 11:16,2015-8-12 15:38,12319上报,南六公路野生动物园门口
1012,1508H7615001,街面秩序,占道无证照经营,（要求立刻到场）反映该处现有乱设摊（烧烤），现在还有十几个人在此聊天喝酒，影响居民休息，请速核实处理。（无需回复，信息保密）,21318.55253,-4033.761957,2015-8-12 23:50,2015-8-13 0:15,2015-8-13 0:15,2015-8-14 15:41,12319上报,川沙镇新德西路508弄
