1482,1508H7881400,街面秩序,占道无证照经营,反映该处每天09:00到21:00有10多个设摊，影响市容通行及周边居民生活，后城管给其回复称门里面属于物业管理，反映人异议门在哪里，对此表示不满，故望相关部门尽快核实处理并回复。,21621.53992,-4329.140006,2015-8-29 10:14,2015-8-29 10:17,2015-8-29 10:18,2015-9-1 14:29,12319上报,川沙路4889弄靠近（潮人商城门口）
1483,1508H7882121,街面秩序,占道无证照经营,【无需回复】反映该处有乱设摊现象，每天09:30-17:00左右有4-5个摊位（卖快餐），影响市容，反映至今未有结果，要求尽快解决，请核实处理。,0,0,2015-8-29 12:14,2015-8-29 12:25,2015-8-29 12:25,2015-9-2 10:10,12319上报,航津路高东一路路口
1484,1508H7878060,环卫市容,跨门营业,反映该处每天19:00以后有跨门营业现象（卖烧烤），影响周边居民生活，请核实处理并回复。,28067.59397,-13369.99893,2015-8-28 21:32,2015-8-28 21:42,2015-8-28 21:42,2015-9-1 14:15,12319上报,祝桥镇千汇路519号附近大华烧烤
1485,1508H7878299,环卫市容,跨门营业,反映该处店面现有跨门营业的现象，严重影响周边居民正常生活，对此表示不满，请核实处理并回复。,2349.634409,-10086.64121,2015-8-29 0:32,2015-8-29 0:53,2015-8-29 0:53,2015-9-1 15:53,12319上报,凌兆路289号（聚缘饭店）
1486,1508H7880656,街面秩序,占道无证照经营,【信息保密，无需回复】反映该处每天06:00开始存在5个乱设摊卖早点，请速核实处理。信息保密,0,0,2015-8-29 9:20,2015-8-29 9:22,2015-8-29 9:22,2015-8-29 16:20,12319上报,灵岩南路211号附近
1487,1508H7880116,环卫市容,跨门营业,（要求尽快处理取缔）反映该处的烧烤店面有跨门营业现象（放置店外卖烧烤），占用道路，影响通行，请核实处理并回复。,9534.456037,-13217.70049,2015-8-29 8:50,2015-8-29 8:53,2015-8-29 8:53,2015-9-2 15:38,12319上报,年家浜路周康路老龙王烧烤店等
1488,1508H7884378,环卫市容,跨门营业,反映该处每天19:00以后有跨门营业现象（卖烧烤），影响周边居民生活，请核实处理并回复。,0,0,2015-8-29 21:02,2015-8-29 21:06,2015-8-29 21:06,2015-9-1 14:15,12319上报,祝桥镇千汇路519号附近大华烧烤
1489,1508H7907834,街面秩序,占道无证照经营,反映08月15日08:30其在上述路段经营爱心早餐车，城管来执法，处理了旁边了一个摊位，其表示还有两个摊位没有处理（该两个摊位可能和城管有关系），城管便没收了其电瓶车，其多次到华益路三林城管办事处去索要，被告知要罚款500元，对此不满，其表示其经营爱心早餐车也是合法的，电瓶车也没有拿来做生意，城管有什么权利和没收？请核实处理并回复。,0,0,2015-8-31 16:33,2015-8-31 17:00,2015-8-31 17:00,2015-9-2 14:51,12319上报,祖冲之路申江路
1490,1508H7877789,街面秩序,占道无证照经营,反映该处每天7:00--8:30和19:00--20:30有大量乱设摊现象（20多个摊位，卖小吃、水果），请核实处理。（信息保密，无需回复。）,28881.52261,-13174.10327,2015-8-28 19:26,2015-8-28 19:28,2015-8-28 19:28,2015-9-1 11:10,12319上报,祝桥镇金闻路100号门口
1491,1508H7884215,街面秩序,占道无证照经营,反映该处有乱设摊现象，严重扰民，对此表示不满，请速核实处理。（无需回复，信息保密）,9225.777834,2249.747281,2015-8-29 19:32,2015-8-29 19:37,2015-8-29 19:37,2015-9-2 16:54,12319上报,博山东路457号
1492,1508H7906245,街面秩序,占道无证照经营,反映该处全天有一辆卡车（卖水果）在此设摊，影响市容，反映之后曾有人联系其，但是没有任何处理效果，请核实处理并回复。,0,0,2015-8-31 15:27,2015-8-31 15:34,2015-8-31 15:34,2015-9-2 13:00,12319上报,樱花路291号东侧
1493,1508H7889926,街面秩序,占道无证照经营,反映上述地址每天16:30--22:00有乱设摊，影响周边居民，对此不满，请核实处理并回复。,0,0,2015-8-30 17:38,2015-8-30 17:59,2015-8-30 17:59,2015-9-2 14:44,12319上报,周浦镇瑞安路瑞阳路
1494,1508H7837697,街面秩序,占道无证照经营,反映该处现有卡车乱设摊的现象（卖西瓜，设摊时间：18:00至22:00），占用道路，影响通行，对此表示不满，请核实处理并回复。,0,0,2015-8-26 19:15,2015-8-26 19:37,2015-8-26 19:37,2015-8-28 10:09,12319上报,创新西路199号
1495,1508H7838146,街面秩序,占道无证照经营,反映该处现有乱设摊（1个烧烤摊）请核实处理。,0,0,2015-8-27 0:27,2015-8-27 1:05,2015-8-27 1:05,2015-8-31 8:45,12319上报,海容路399号门
1496,1508H7842202,街面秩序,占道无证照经营,（信息保密、不需回复）。反映该处有乱设摊现象，每天09:30-17:00左右有4-5个摊位（卖快餐），影响市容，请核实处理。,13426.26346,11721.93111,2015-8-27 8:50,2015-8-27 8:53,2015-8-27 8:53,2015-8-28 10:16,12319上报,航津路高东一路路口
1497,1508H7886232,街面秩序,占道无证照经营,反映该处现存有大量乱设摊现象（混合性设摊），请核实处理。信息保密,10516.99825,-9178.570794,2015-8-30 8:44,2015-8-30 8:51,2015-8-30 8:51,2015-9-2 15:10,12319上报,康桥路御秀路
1498,1508H7890439,环卫市容,跨门营业,反映该处现有跨门营业营业现象（傍晚开始至凌晨4点），影响周边居民生活，请核实处理回复。,0,0,2015-8-30 21:21,2015-8-30 21:55,2015-8-30 21:55,2015-9-2 14:21,12319上报,年家浜路周康路(老龙王烧烤)
1499,1508H7890599,街面秩序,占道无证照经营,反映该处现有乱设摊现象（2个烧烤摊，每天22:00多开始持续至半夜），现来电表示反映后未见城管到场执法，对此不满，请尽快核实处理（信息保密，无需回复）,4578.884513,925.2587513,2015-8-30 23:03,2015-8-31 6:51,2015-8-31 6:51,2015-8-31 9:00,12319上报,东方路昌邑路
1500,1508H7890652,街面秩序,占道无证照经营,反映该处现有大量乱设摊（大约有100多个摊位），影响周边居民生活，请核实处理。（信息保密）,0,0,2015-8-30 23:27,2015-8-31 6:45,2015-8-31 6:45,2015-8-31 10:37,12319上报,南芦公路45号门口
1501,1508H7846767,环卫市容,暴露垃圾,反映该处被人私自设立一建筑垃圾堆放点，每日不断有大型车辆进出堆放垃圾影响居民生活，请速核实处理并回复。（有废品回收再加工情况，加工机器噪音扰民。）,3893.546445,-5043.400616,2015-8-27 9:39,2015-8-27 9:52,2015-8-27 9:52,,12319上报,南码头路 昌七居委会旁边
1502,1508H7830201,环卫市容,跨门营业,【与诉求人先行联系，其表示该处应为联明路226号】反映上述地址有跨门经营现象，（切割机放置外面操作），请核实处理。,4545.09915,-8968.876742,2015-8-26 11:45,2015-8-26 12:04,2015-8-26 12:04,2015-8-27 9:59,12319上报,联明路226号
1503,1508H7891023,街面秩序,占道无证照经营,反映上述地址现有大量乱设摊现象，影响通行，请尽快核实处理并回复。,0,0,2015-8-31 6:09,2015-8-31 6:38,2015-8-31 6:38,2015-8-31 10:06,12319上报,向阳路234号
1504,1508H7905437,街面秩序,占道无证照经营,反映该处每天14:00-17:00有大面积无证设摊现象（贩卖种类多），影响市容和周边居民生活。请核实处理并回复。,0,0,2015-8-31 15:03,2015-8-31 15:08,2015-8-31 15:08,2015-9-1 10:38,12319上报,芦潮港镇航湾路水闸桥往西100米
1505,1508H7905439,环卫市容,跨门营业,反映上述地址每天全天有跨门经营，影响交通，请核实处理并回复。,9566.930501,-14334.9668,2015-8-31 15:03,2015-8-31 15:07,2015-8-31 15:07,2015-9-2 16:02,12319上报,繁荣路3号
1506,1508H7905440,环卫市容,暴露垃圾,反映该处现有大量混合垃圾堆积现象，影响市容和周边居民生活。故望相关部门尽快核实处理并回复。,20863.83287,-3149.500495,2015-8-31 15:03,2015-8-31 15:36,2015-9-10 14:55,2015-9-10 15:05,12319上报,敬业路浦东运河桥西侧
1507,1508H7830202,环卫市容,跨门营业,（信息保密，无需回复)反映上述地址商铺有跨门营业行为，将高音喇叭放在门外，影响周边居民生活，请核实处理。,12159.7137,5695.389412,2015-8-26 11:45,2015-8-26 11:56,2015-8-26 11:56,2015-8-27 8:41,12319上报,双桥路五莲路（菜场对面电动车商铺）
1508,1508H7901454,街面秩序,占道无证照经营,反映该处有人正在无证设摊，影响居民生活，请核实处理并回复。,5411.797409,-264.7458898,2015-8-31 10:57,2015-8-31 11:09,2015-8-31 11:09,2015-9-2 14:44,12319上报,张杨路福山路
1509,1508H7901456,街面秩序,占道无证照经营,反映该处有一个乱设摊卖盒饭现象，影响市容及居民出行，请处理并回复。,6381.424301,-4115.401139,2015-8-31 10:57,2015-8-31 11:02,2015-8-31 11:02,2015-9-2 9:50,12319上报,锦绣路2400号（锦绣小学后门口）
1510,1508H7908612,街面秩序,占道无证照经营,反映该处每天17:00~23:00有一个乱设摊（卖水果），严重影响周围居民出行，而该问题反映至今，相关单位虽到场处理，但力度不足，城管处理之后乱设摊还是出现了，随后施姓城管队长（手机：181开头）联系反映人称“我们管不了，随便你怎么投诉没关系的”对此表示极度不满。反映人表示只要处理工作日的设摊问题即可，请速核实处理并回复。,10846.2842,1534.364384,2015-8-31 18:57,2015-8-31 19:09,2015-8-31 19:09,2015-9-5 14:40,12319上报,银山路枣庄路口
1511,1508H7908467,街面秩序,占道无证照经营,反映该处现在有设摊现象（两个摊位，每天都是这个时段开始），对此不满，请核实处理（信息保密，无需回复）,14845.84967,-5232.960774,2015-8-31 18:15,2015-8-31 18:32,2015-8-31 18:32,2015-9-7 10:03,12319上报,顺和路126弄孙桥小学对面
1512,1508H7858747,街面秩序,占道无证照经营,该处现有大量乱设摊现象（50至100个摊位左右），称其之前有一直拨打城管电话但无人前来，请处理。,11215.79924,-15804.19381,2015-8-27 19:32,2015-8-27 19:40,2015-8-27 19:40,2015-9-2 10:37,12319上报,瑞安路瑞阳路
1513,1508H7871545,街面秩序,占道无证照经营,（信息保密、不需回复）反映该处有乱设摊现象，每天09:30-17:00左右有4-5个摊位（卖快餐），影响市容，反映至今未有结果，要求尽快解决，请核实处理。,13426.26346,11721.93111,2015-8-28 13:03,2015-8-28 13:04,2015-8-28 13:04,2015-9-2 10:06,12319上报,航津路高东一路路口
1514,1508H7859026,街面秩序,占道无证照经营,该处有乱设摊现象，对此表示不满，请处理并回复。,19284.68891,-8169.662124,2015-8-27 21:38,2015-8-27 21:41,2015-8-27 21:41,2015-9-1 14:21,12319上报,川沙地铁站2号口
1515,1508H7902450,街面秩序,占道无证照经营,（信息保密、不需回复）。反映该处有乱设摊现象，每天10:30~14:00有4-5个摊位（卖快餐），影响市容，请核实处理（信息保密、不需回复）。,13954.84715,12043.12289,2015-8-31 12:57,2015-8-31 12:59,2015-8-31 12:59,2015-9-2 10:16,12319上报,航津路高东路路口
1516,1508H7908759,环卫市容,跨门营业,反映该处店面有跨门营业的现象，占用道路影响通行，对此表示不满，请速核实处理。（信息保密，无需回复）,6246.13997,-466.42301,2015-8-31 19:33,2015-8-31 19:36,2015-8-31 19:36,2015-9-7 9:50,12319上报,羽山路38号
1517,1508H7870543,街面秩序,占道无证照经营,【无需回复】反映该处现在有设摊现象（设摊收废品，废旧家具、空调都堆在路上），严重影响通行且气味扰民，再次来电要求加强力度整治，请核实处理,0,0,2015-8-28 11:26,2015-8-28 11:29,2015-8-28 11:29,2015-8-28 17:18,12319上报,东明村康家宅东明家具广场旁边（和板泉路交界的道路）
1518,1508H7887925,街面秩序,占道无证照经营,反映该处现有大量乱设摊现象，影响通行，请核实处理并回复。,0,0,2015-8-30 11:20,2015-8-30 11:28,2015-8-30 11:28,2015-9-1 15:05,12319上报,张江镇建中路古桐路
1519,1508H7877769,街面秩序,占道无证照经营,反映该处每天18:00--22:00左右有3-4个左右乱设摊卖烧烤、水果现象，影响市容及居民出行，请处理。（信息保密，无需回复）,15736.84596,-5066.965254,2015-8-28 19:14,2015-8-28 19:17,2015-8-28 19:17,2015-9-1 14:47,12319上报,孙环路华夏中路（川杨新苑4期）
1520,1508H7890400,环卫市容,跨门营业,反映该处每天19:00以后有跨门营业现象（卖烧烤），影响周边居民生活，反映后未果，对此不满，请核实处理并回复。,0,0,2015-8-30 20:56,2015-8-30 20:59,2015-8-30 20:59,2015-9-1 14:15,12319上报,祝桥镇千汇路519号附近大华烧烤
1521,1508H7890411,街面秩序,占道无证照经营,反映该处有大量乱设摊，严重影响周边居民正常生活，对此表示不满，请核实处理并回复。,0,0,2015-8-30 21:02,2015-8-30 21:08,2015-8-30 21:08,2015-9-2 8:36,12319上报,博山路50弄
1522,1508H7769558,街面秩序,占道无证照经营,反映该处正有卡车设摊，贩卖水果，请处理并回复。【（质协回访）反映人表示该情况依然存在，请核实处理并回复。 】,10958.45805,8807.619783,2015-8-21 15:02,2015-8-21 15:11,2015-8-21 15:11,2015-8-26 10:34,12319上报,启帆路近繁锦路
1523,1508H7769559,街面秩序,占道无证照经营,反映该处现有卡车停靠乱设摊现象，影响出行，对此不满，请尽快核实处理并回复。【（质协回访）反映人表示该情况依然存在，请核实处理并回复。 】,6376.906875,-3538.170253,2015-8-21 15:02,2015-8-21 15:12,2015-8-21 15:12,2015-8-25 9:57,12319上报,东建路1432号
1524,1508H7769561,街面秩序,占道无证照经营,反映该处正有卡车设摊，贩卖水果，请处理并回复。【（质协回访）反映人表示该情况依然存在，请核实处理并回复。 】,10958.45805,8807.619783,2015-8-21 15:02,2015-8-21 15:10,2015-8-21 15:10,2015-8-26 10:09,12319上报,启帆路近繁锦路
1525,1508H7769562,街面秩序,占道无证照经营,反映该处每天17:00~19:00有卡车停靠乱设摊现象，影响出行，对此不满，请尽快核实处理并回复。【（质协回访）反映人表示该情况依然存在，请核实处理并回复。 】,6933.13059,-3392.15901,2015-8-21 15:02,2015-8-21 15:13,2015-8-21 15:13,2015-8-26 10:31,12319上报,浦建路1432号
1526,1508H7891228,街面秩序,占道无证照经营,反映上述地址现有大量乱设摊现象，影响通行，请尽快核实处理并回复。城管到过现场，但是现在设摊又出来了。,0,0,2015-8-31 6:45,2015-8-31 6:46,2015-8-31 6:46,2015-8-31 10:11,12319上报,向阳路234号
1527,1508H7884931,街面秩序,占道无证照经营,反映该处现正有4个夜排档设摊，望处理。（信息保密，无需回复）,4204.200608,-5981.629607,2015-8-30 6:08,2015-8-30 6:42,2015-8-30 6:42,2015-9-2 10:31,12319上报,昌里东路南码头路口
1528,1508H7884437,环卫市容,跨门营业,（要求尽快处理取缔）反映该处的烧烤店面有跨门营业现象（放置店外卖烧烤），占用道路，影响通行，请核实处理并回复。,9534.456037,-13217.70049,2015-8-29 21:44,2015-8-29 22:24,2015-8-29 22:24,2015-9-2 14:47,12319上报,年家浜路周康路老龙王烧烤店等
1529,1508H7765612,环卫市容,跨门营业,反映该处每天04:00~20:00有3~4个跨门营业卖早点现象，影响市容及居民出行，请处理并回复。,0,0,2015-8-21 10:56,2015-8-21 11:09,2015-8-21 11:09,2015-8-24 9:29,12319上报,工农南路355号~367号
1530,1508H7805735,环卫市容,跨门营业,【无需回复】反映该处有跨门营业的现象，影响生活，请核实处理。信息保密。,0,0,2015-8-25 10:15,2015-8-25 10:18,2015-8-25 10:18,2015-8-26 13:54,12319上报,永春东路28号
1531,1508H7806084,街面秩序,占道无证照经营,【无需回复】反映该处每天06:00--12:00左右有大量乱设摊卖鱼，蔬菜现象，影响市容及居民出行，请处理。（信息保密，不需回复）,12022.37904,4874.656949,2015-8-25 10:21,2015-8-25 10:26,2015-8-25 10:26,2015-8-27 8:39,12319上报,归昌路凌河路路口
1532,1508H7858258,环卫市容,跨门营业,（信息保密，无需回复）反映上述地址商铺有跨门营业行为，将高音喇叭放在门外，影响周边居民生活，请核实处理。,12159.7137,5695.389412,2015-8-27 17:21,2015-8-27 17:33,2015-8-27 17:33,2015-8-28 15:13,12319上报,双桥路五莲路（菜场对面电动车商铺）
1533,1508H7890340,街面秩序,占道无证照经营,反映上述地址16:30--21:00大量乱设摊现象，影响市容，对此表示不满，请速核实处理。（信息保密）,0,0,2015-8-30 20:20,2015-8-30 20:23,2015-8-30 20:23,2015-9-2 14:20,12319上报,瑞安路靠近瑞阳路
1534,1508H7815291,街面秩序,占道无证照经营,【无需回复】反映该处16：00下班高峰时段有大面积无证设摊现象（贩卖种类多），影响市容和通行。问题已多次来电反映，但现问题依然存在。故望相关部门尽快核实处理并回复。,0,0,2015-8-25 16:56,2015-8-25 17:00,2015-8-25 17:00,2015-8-28 9:29,12319上报,周祝公路2111号对面
1535,1508H7815351,街面秩序,占道无证照经营,反映该处16：00下班高峰时段有大面积无证设摊现象（贩卖种类多），影响市容和通行。问题已多次来电反映，但现问题依然存在。故望相关部门尽快核实处理并回复。,0,0,2015-8-25 17:02,2015-8-25 17:16,2015-8-25 17:16,2015-8-28 9:29,12319上报,周祝公路2111号对面
1536,1508H7815352,街面秩序,占道无证照经营,该处现在有设摊现象，影响居民生活，请核实处理并回复。,11238.23041,8363.191782,2015-8-25 17:02,2015-8-25 17:17,2015-8-25 17:17,2015-8-27 13:36,12319上报,张杨北路芳菲路
1537,1508H7815434,环卫市容,乱涂写、乱张贴、乱刻画,反映该处地面有张贴广告现象，每逢下雨天地面会很滑，导致居民摔倒，请核实处理并回复。,5498.599714,508.6742869,2015-8-25 17:14,2015-8-25 17:19,2015-8-25 17:19,2015-8-26 10:31,12319上报,乳山路206号门口
1538,1508H7886993,环卫市容,跨门营业,（反映人表示相关部门回复未告知具体处理结果，对此不满）反映该处的烧烤店面有跨门营业现象（放置店外卖烧烤），占用道路，影响通行，请核实处理并回复。,0,0,2015-8-30 9:38,2015-8-30 9:44,2015-8-30 9:44,2015-9-2 14:48,12319上报,年家浜路周康路老龙王烧烤店等
1539,1508H7804168,街面秩序,占道无证照经营,（信息保密，无需回复。）反映该处每天全天有设摊现象，请核实处理。,8284.85786,13477.80267,2015-8-25 9:51,2015-8-25 9:55,2015-8-25 9:55,2015-8-26 8:38,12319上报,江东路近港城路 浦东北路向北300米
1540,1508H7869469,街面秩序,占道无证照经营,【无需回复】反映上述地址每天11:30至13:00左右有大量乱设摊现象，请尽快核实处理。,0,0,2015-8-28 10:33,2015-8-28 10:35,2015-8-28 10:35,2015-9-1 10:09,12319上报,晨辉路88号
1541,1508H7804979,环卫市容,跨门营业,反映该处现在有快餐店跨门营业现象（每天晚上都有），油烟扰民，对此不满，请核实处理并回复。【该处跨门营业现象是否改善，请反馈最终处理结果。 】,8646.414884,-4882.238726,2015-8-25 10:03,2015-8-25 10:07,2015-8-25 10:07,2015-8-28 15:28,12319上报,北蔡镇高科西路3000弄旁边（蓝海博龙酒店对面）
1542,1508H7829847,街面秩序,占道无证照经营,反映上述地址现有乱设摊现象（三轮车设摊，卖烧烤），请速核实处理。（信息保密）【重复件，请按重复投诉件的要求上传附件或书面传真反馈，采用一事一报。书面报告内容：1、投诉基本情况；2、处理单位所做的主要工作；3、目前现状；4、造成重复投诉的原因；5、与诉求人沟通的情况；6、下一步打算。 】,4409.708961,-8663.188138,2015-8-26 11:14,2015-8-26 12:12,2015-8-28 15:21,2015-8-31 9:13,12319上报,东明路杨南路
1543,1508H7829971,街面秩序,占道无证照经营,反映上述地址现有大量乱设摊现象，影响通行，请尽快核实处理并回复。【重复件，请按重复投诉件的要求上传附件或书面传真反馈，采用一事一报。书面报告内容：1、投诉基本情况；2、处理单位所做的主要工作；3、目前现状；4、造成重复投诉的原因；5、与诉求人沟通的情况；6、下一步打算。】,0,0,2015-8-26 11:20,2015-8-26 12:09,2015-8-26 12:09,2015-8-31 15:30,12319上报,向阳路234号
1544,1508H7832055,环卫市容,暴露垃圾,反映该处人行道有十多根铁杆，影响通行，要求清理，请速核实处理并回复。,9455.480133,-12764.80005,2015-8-26 13:57,2015-8-26 14:43,2015-8-26 15:04,2015-8-27 9:37,12319上报,上南路7777号
1545,1508H7842561,环卫市容,暴露垃圾,（信息保密 无需回复）反映该处有土方车经过，导致渣土散落，请核实处理。,6524.47,-8420.4,2015-8-27 8:54,2015-8-27 8:54,2015-8-27 8:54,2015-8-31 9:41,12319上报,外环线（华夏路――龙阳路）南向北方向
1546,1508H7780203,街面秩序,占道无证照经营,反映该处每天19:00-日此02:00有无证烧烤摊位，影响市容和周边居民生活。反映人自称此问题已反映多时，但问题未见改善。反映人对当地相关职能部门的处理态度表示强烈不满，反映人称如此问题再得到不解决，此会将此问题再向上级反映。故望相关部门尽快核实处理。（信息保密 无需回复）,18666.46254,-4706.443782,2015-8-23 12:21,2015-8-23 12:22,2015-8-23 12:22,2015-8-24 14:06,12319上报,川沙新镇新德西路508弄门口
1547,1508H7780204,环卫市容,暴露垃圾,反映该处现有建筑垃圾堆积，影响通行，请核实处理回复。,38237.97651,-39893.70695,2015-8-23 12:21,2015-8-23 13:21,2015-8-23 13:21,2015-8-26 10:41,12319上报,芦潮港沧海路向西到底近妙香路
1548,1508H7766612,环卫市容,跨门营业,反映该处每天早上05:30--10:00左右存有跨门营业现象，来电表示反映后有回复，但问题依旧，请核实处理回复。,0,0,2015-8-21 12:32,2015-8-21 12:41,2015-8-21 12:41,2015-8-26 13:39,12319上报,三彩路503号
1549,1508H7829973,街面秩序,占道无证照经营,反映该处每天11:00-13:00有10乱设摊卖小吃现象，该问题反映后，未到场未处理，影响市容及居民出行，反映人要求尽快与其联系，请处理并回复。,4992.269729,-3200.853925,2015-8-26 11:20,2015-8-26 11:51,2015-8-26 11:51,2015-8-26 15:00,12319上报,东方路北园路（近儿童医学中心）
1550,1508H7829846,街面秩序,占道无证照经营,反映该处每天09:00到21:00有10多个设摊，影响市容通行及周边居民生活。该问题已反映多时，但至今未见问题有所改善，反映人称川沙城管联系其称会处理此事，但情况未改善表示不满，故望相关部门尽快核实处理并回复。【重复件，请按重复投诉件的要求上传附件或书面传真反馈，采用一事一报。书面报告内容：1、投诉基本情况；2、处理单位所做的主要工作；3、目前现状；4、造成重复投诉的原因；5、与诉求人沟通的情况；6、下一步打算。 】,21621.53992,-4329.140006,2015-8-26 11:14,2015-8-26 12:10,2015-8-26 12:10,2015-9-1 10:23,12319上报,川沙路4889弄靠近（潮人商城门口）
1551,1508H7887086,街面秩序,占道无证照经营,反映该处有人正在无证设摊，影响居民生活，请核实处理并回复。,0,0,2015-8-30 9:44,2015-8-30 10:37,2015-8-30 10:37,2015-8-31 7:26,12319上报,张杨路福山路
1552,1508H7858791,街面秩序,占道无证照经营,该处有大量乱设摊（卖水果），影响居民生活，请处理。,29055.98416,-13853.17585,2015-8-27 19:50,2015-8-27 20:13,2015-8-27 20:13,2015-8-28 9:14,12319上报,金闻路100号附近
1553,1508H7858792,街面秩序,占道无证照经营,该处现有摊位占用人行道卖杂货品，影响市容，请处理并回复。,6862.639395,-3561.767173,2015-8-27 19:50,2015-8-27 20:23,2015-8-27 20:23,2015-8-31 14:29,12319上报,锦安东路280弄（迪亚天天超市门口）
1554,1508H7814268,街面秩序,占道无证照经营,【无需回复】反映该处每天早晚有设摊（三四个，卖早点，凉粉，水果等），影响市容和通行，请核实处理。（信息保密，无需回复）,26731.3177,-11255.78685,2015-8-25 15:56,2015-8-25 16:00,2015-8-25 16:00,2015-8-28 9:28,12319上报,凌空路地铁站靠近华洲路
1555,1508H7858775,街面秩序,占道无证照经营,该处每天09:00--00:00有乱设摊（1个摊位，卖大米），对此不满，请处理并回复。（19：50 已先行联系）,25842.28487,-20173.53359,2015-8-27 19:44,2015-8-27 19:52,2015-8-27 19:52,2015-8-28 15:57,12319上报,听潮路836号近沪南公路（惠南九组门口）
1556,1508H7859247,街面秩序,占道无证照经营,该处现有乱设摊现象，影响居民生活，请处理。,15703.02017,-3601.996837,2015-8-28 0:56,2015-8-28 2:48,2015-8-28 2:48,2015-9-1 10:14,12319上报,张东路益江路
1557,1508H7884295,街面秩序,占道无证照经营,反映上述地址现有乱设摊现象（16:30到22:30），请速核实处理。（信息保密不需回复）,4409.708961,-8663.188138,2015-8-29 20:02,2015-8-29 20:10,2015-8-29 20:10,2015-8-31 13:25,12319上报,东明路杨南路
