471,1507H7224998,街面秩序,占道无证照经营,反映该处每天09:00~23:00有一个乱设摊（卖水果），严重影响周围居民出行，而该问题反映至今，相关单位虽到场处理，但力度不足，城管处理之后乱设摊还是出现了，随后施姓城管队长（手机：181开头）联系反映人称“我们管不了，随便你怎么投诉没关系的”对此表示极度不满，请速核实处理并回复。,10846.2842,1534.364384,2015-7-18 17:37,2015-7-18 17:49,2015-7-18 17:49,2015-7-23 13:39,12319上报,银山路枣庄路口
472,1507H7224999,街面秩序,机动车乱停放、非机动车乱停放,（参考编号：1507360343，来电补充城管队长手机号）反映该处每天09:00~23:00有一个乱设摊（卖水果），严重影响周围居民出行，而该问题反映至今，相关单位虽到场处理，但力度不足，城管处理之后乱设摊还是出现了，随后施姓城管队长（手机：18117342393）联系反映人称“我们管不了，随便你怎么投诉没关系的”对此表示极度不满，请速核实处理并回复。,10846.2842,1534.364384,2015-7-18 17:37,2015-7-18 17:49,2015-7-18 17:49,2015-7-23 13:48,12319上报,银山路枣庄路口
473,1507H7225012,街面秩序,占道无证照经营,（信息保密 无需回复）反映该桥上每天从08:00开始就有大量无证设摊现象（贩卖种类多），影响市容和周边居民出行。故望相关部门尽快核实处理。（信息保密 无需回复）,0,0,2015-7-18 17:43,2015-7-18 17:47,2015-7-18 17:47,2015-7-21 18:09,12319上报,高东镇上钦路（杨元大桥上）
474,1507H7225542,街面秩序,占道无证照经营,反映该处每天23:00以后有乱设摊现象，（一个烧烤摊位）影响周边居民生活，请核实处理并回复。,2795.503647,-10342.60696,2015-7-18 21:55,2015-7-18 22:00,2015-7-18 22:00,2015-7-22 14:33,12319上报,灵岩南路1203号门口
475,1507H7225480,街面秩序,占道无证照经营,反映上述地址现有乱设摊现象，请速核实处理并回复。,23470.65442,582.200287,2015-7-18 21:13,2015-7-18 21:17,2015-7-18 21:17,2015-7-20 9:21,12319上报,东川公路前哨路
476,1507H7225481,环卫市容,跨门营业,反映上述地址阿强光头烧烤店跨门经营，要求尽快处理答复，请尽快核实处理并回复。,9624.919077,-10578.04187,2015-7-18 21:13,2015-7-18 21:18,2015-7-18 21:18,2015-7-22 15:06,12319上报,康沈路493-495号
477,1507H7222731,环卫市容,暴露垃圾,来电投诉该处星金家园小区外的四周杂草丛生，垃圾堆积严重，影响周围小区的生活，请核实处理并回复。,0,0,2015-7-18 10:43,2015-7-18 10:54,2015-7-18 10:54,2015-7-23 15:28,12319上报,曹路镇海松路星金家园靠近金砖路西面
478,1507H7222836,街面秩序,占道无证照经营,反映该处每天22:30-23:00有多个夜排档，油烟扰民，请核实处理。,5032.369985,-2403.010052,2015-7-18 11:01,2015-7-18 11:41,2015-7-18 11:41,2015-7-20 11:38,12319上报,蓝村路510号对面
479,1507H7225526,环卫市容,跨门营业,反映该处店铺老北京羊蝎子每天17:00--次日04:00左右有跨门营业卖烧烤现象，影响市容及居民出行，请核实处理并回复。,7911.017892,1324.736896,2015-7-18 21:43,2015-7-18 21:48,2015-7-18 21:48,2015-7-20 10:01,12319上报,崮山路85号（老北京羊蝎子）
480,1507H7236963,环卫市容,暴露垃圾,反映该处道路上都有堆积餐厨垃圾，影响环境，请核实处理回复。,0,0,2015-7-20 9:02,2015-7-20 9:09,2015-7-20 9:09,2015-7-21 9:14,12319上报,外高桥草高支路1009号近和龙路
481,1507H7225736,街面秩序,占道无证照经营,反映该处每天22:30--03:00左右有乱设摊现象（2~3夜排档），严重扰民，城管走后，摊位会返潮，对此表示不满，请速核实处理并回复。,5691.580226,-2382.301988,2015-7-18 23:43,2015-7-18 23:49,2015-7-18 23:49,2015-7-20 15:36,12319上报,蓝村路55弄
482,1507H7225793,环卫市容,跨门营业,反映该处每天19:00至次日04:00都有跨门营业现象（夜排档），油烟味严重，多次投诉一直未见处理部门到场管理，对此不满，请尽快处理。（无需回复，信息保密）,2891.490079,-7731.470121,2015-7-19 0:49,2015-7-19 1:21,2015-7-19 1:21,2015-7-20 13:55,12319上报,杨思路945号至949号
483,1507H7226742,街面秩序,占道无证照经营,反映该处每天早上05:30-07：30左右以及14:30-18:00左右现有10个左右的乱设摊卖蔬菜，且情况严重，影响市容，反映之后情况并得到改善，现来催办，希望取缔，请核实处理。,32972.93408,-29211.34547,2015-7-19 8:01,2015-7-19 8:12,2015-7-19 8:12,2015-7-22 14:07,12319上报,振万路万和路
484,1507H7225405,街面秩序,占道无证照经营,反映该处现有乱设摊（数量：20个左右），请核实处理并回复。,29240.36841,-14420.63026,2015-7-18 20:25,2015-7-18 20:27,2015-7-18 20:27,2015-7-21 9:52,12319上报,金闻路79号门口
485,1507H7181064,街面秩序,占道无证照经营,反映该处全天有设摊现象（7~8左右，卡车上设摊），扰民严重，请核实处理并回复。要求城管不要泄露其私人信息,4303.468288,309.0387507,2015-7-16 12:13,2015-7-16 12:39,2015-7-16 12:39,2015-7-16 15:38,12319上报,崂山四村内停车道上近乳山路的进出口
486,1507H7181388,街面秩序,占道无证照经营,[无需回复]反映该处每天10:00--18:00有乱设摊现象（大量摊位）请核实处理。,0,0,2015-7-16 12:25,2015-7-16 12:41,2015-7-16 12:41,2015-7-17 15:56,12319上报,芦芸路港辉路
487,1507H7226122,街面秩序,占道无证照经营,反映上述地址现有乱设摊现象，占道设摊，影响道路通行，请速核实处理。,7555.179427,-4337.670822,2015-7-19 6:37,2015-7-19 6:49,2015-7-19 6:49,2015-7-21 15:51,12319上报,芳华路菜场附近靠近申波路
488,1507H7221100,街面秩序,占道无证照经营,（信息保密，无需回复。）反映该处每天09:00不到至18:00有设摊现象，喇叭噪音扰民，请处理。,11753.68631,3615.253474,2015-7-18 8:55,2015-7-18 9:04,2015-7-18 9:04,2015-7-20 16:24,12319上报,菏泽路567弄内
489,1507H7168348,街面秩序,占道无证照经营,反映该处每天5点左右开始有乱设摊现象（卖菜），请核实处理。（信息保密，无需回复。）,2774.337311,-10507.39918,2015-7-16 6:20,2015-7-16 6:22,2015-7-16 6:22,2015-7-17 10:58,12319上报,中林街131弄21号
490,1507H7230916,街面秩序,占道无证照经营,【无需回复】反映该处现有乱设摊现象，影响市容市貌，请核实处理。（信息保密，无需回复）,0,0,2015-7-19 16:25,2015-7-19 16:53,2015-7-19 16:53,2015-7-20 14:55,12319上报,东大公路南团公路
491,1507H7118271,街面秩序,占道无证照经营,反映该处有大量乱设摊，影响居民生活，请核实处理并回复。,0,0,2015-7-13 15:49,2015-7-13 15:54,2015-7-13 15:54,2015-7-16 10:23,12319上报,张江镇益江路靠近盛夏路
492,1507H7071061,街面秩序,占道无证照经营,（信息保密，不需回复）反映该处每天05:30~18:00有大量乱设摊现象，对此表示不满，请速核实处理。,27786.6783,-13797.83079,2015-7-10 8:37,2015-7-10 8:47,2015-7-10 8:47,2015-7-10 10:16,12319上报,百熙路东港集贸市场东门
493,1507H7209957,环卫市容,暴露垃圾,反映上述地址现有大量混合垃圾堆积，影响周边居民正常生活，请核实处理并回复。,7870.100036,634.959871,2015-7-17 10:38,2015-7-17 12:05,2015-7-17 16:05,2015-7-20 15:22,12319上报,张杨路2100弄和洋泾浜桥之间（夹缝）
494,1507H7209960,街面秩序,占道无证照经营,（信息保密、不需回复）。反映该处现有一处乱设摊卖水果现象，影响市容及居民出行，请速核实处理。,8572.78042,2831.861985,2015-7-17 10:38,2015-7-17 10:40,2015-7-17 10:40,2015-7-23 10:21,12319上报,居家桥路浦东大道（车站）
495,1507H7157479,街面秩序,占道无证照经营,反映该处每天22时至第二天凌晨有乱设摊现象（夜排档），严重影响周边居民生活，对此不满，请核实处理（信息保密）。,4869.050753,-2381.395236,2015-7-15 10:48,2015-7-15 10:53,2015-7-15 10:53,2015-7-16 8:59,12319上报,南泉路蓝村路
496,1507H7068380,街面秩序,占道无证照经营,"反映该处有跨门营业现象（中午到凌晨5点，冰箱和棚子一直放置在外），其称

投诉两个月一直没有人处理过，城管给其答复称历史遗留问题，对此回复不满，请核实处理并回复。",0,0,2015-7-9 23:01,2015-7-9 23:40,2015-7-9 23:40,2015-7-11 10:43,12319上报,林恒路1191号
497,1507H7080844,街面秩序,占道无证照经营,【与诉求人先行联系，其表示该处是早餐疏导点，反映人认为，这是街道照顾4050工程，应该是让本社区本地人设摊，现该处多为其它区域或者外地来沪人员，其表示不理解，要求尽快核实处理并回复】反映该处每天6:30到12：00有设摊现象，请处理并回复。,10220.47325,1630.639424,2015-7-10 12:31,2015-7-10 12:58,2015-7-10 12:58,2015-7-16 9:41,12319上报,金杨路金口路
498,1507H7193176,环卫市容,跨门营业,反映该处店面存在跨门营业影响居民生活，请核实处理。（信息保密不需要回复）,0,0,2015-7-16 19:49,2015-7-16 20:48,2015-7-16 20:48,2015-7-22 8:39,12319上报,三三公路249号水果店
499,1507H7078950,街面秩序,占道无证照经营,（信息保密，无需回复。）反映该处现有乱设摊现象（卖自行车及修车），称其常年设摊，请核实处理。（信息保密，无需回复。）,17945.00647,-2320.857222,2015-7-10 10:19,2015-7-10 10:39,2015-7-10 10:39,2015-7-14 10:06,12319上报,齐爱路628号
500,1507H7096641,街面秩序,占道无证照经营,反映该处现有乱设摊现象（2个摊位，卖衣物、鞋子），影响市容及通行，请尽快核实处理并回复。,7829.647236,-2953.588388,2015-7-12 16:43,2015-7-12 16:51,2015-7-12 16:51,2015-7-13 16:55,12319上报,樱花路292号门口
501,1507H7061434,环卫市容,暴露垃圾,反映该处（迪卡侬正对面）绿地上的三棵树被砍伐，用于堆放垃圾，导致臭气熏天，严重影响市容（该处有很多外国人居住），对此反映人表示极度不满，请核实处理并回复。,7919.623556,-240.8930898,2015-7-9 12:13,2015-7-9 12:43,2015-7-9 12:43,2015-7-15 11:33,12319上报,杨高中路靠近云山路
502,1507H7067736,街面秩序,占道无证照经营,反映该处每天16:00-19:00有乱设摊现象（卖水果），影响交通，请核实处理回复。,8663.81098,1741.016256,2015-7-9 18:07,2015-7-9 18:18,2015-7-9 18:18,2015-7-15 14:49,12319上报,德平路博山东路
503,1507H7201479,街面秩序,占道无证照经营,反映上述地址现有乱设摊现象（卖鱼卖水果卖菜），影响出行，请核实处理并回复。（反映人表示上述地址属于三林镇）,2338.370111,-12259.68997,2015-7-17 8:50,2015-7-17 9:02,2015-7-17 9:02,2015-7-19 9:31,12319上报,浦星公路498号
504,1507H7221285,环卫市容,跨门营业,反映该处水果店跨门营业，放置喇叭扰民严重，影响周边居民，请尽快核实处理并回复。,8019.208132,412.7988148,2015-7-18 9:01,2015-7-18 9:18,2015-7-18 9:18,2015-7-23 14:41,12319上报,灵山路1727号旁边
505,1507H7159796,街面秩序,占道无证照经营,【信息保密，无需回复】反映该处每天晚上18:30开始存在乱设摊摆夜排档，影响附近居民生活，请处。（信息保密，无需回复）,23213.09023,-22896.60597,2015-7-15 12:31,2015-7-15 12:51,2015-7-15 12:51,2015-7-16 16:20,12319上报,惠南镇宣黄公路南芦公路口
506,1507H7159797,街面秩序,占道无证照经营,反映该处每天20:30左右有大量乱设摊他（十几个摊位），影响周边居民生活，请核实处理。,18290.76171,-2912.79978,2015-7-15 12:32,2015-7-15 12:53,2015-7-15 12:53,2015-7-17 15:19,12319上报,齐爱路创新中路
507,1507H7067547,街面秩序,占道无证照经营,反映该处现有乱设摊现象，现有开始复苏，对此不满，请核实处理并回复。,5343.249965,-11061.91675,2015-7-9 17:19,2015-7-9 17:25,2015-7-9 17:25,2015-7-11 10:44,12319上报,林鸣路靠近上南路
508,1507H7087368,街面秩序,占道无证照经营,反映该处每天16:00开始有2-3个乱设摊，影响行人通行，请核实处理,22397.52367,-7640.826121,2015-7-10 17:38,2015-7-10 17:47,2015-7-10 17:47,2015-7-13 15:31,12319上报,川沙路川展路
509,1507H7157589,街面秩序,占道无证照经营,【信息保密，无需回复】反映该处每天全天有设摊，严重影响周边环境，请处理。（无需回复）,36861.00128,-39465.34801,2015-7-15 10:50,2015-7-15 10:55,2015-7-15 10:55,2015-7-16 16:56,12319上报,港辉路525号门口
510,1507H7119856,街面秩序,占道无证照经营,反映该处每天16:00开始有乱设摊（2个摊位，卖水果），影响通行，对此不满，请核实处理。（信息保密、不需回复）,0,0,2015-7-13 18:49,2015-7-13 18:52,2015-7-13 18:52,2015-7-15 14:48,12319上报,华夏东路孙环路
511,1507H7163547,街面秩序,占道无证照经营,【信息保密，无需回复】反映该处现有乱设摊（2个摊位，卖水果），影响通行，对此不满，请核实处理。（信息保密，无需回复）,0,0,2015-7-15 14:50,2015-7-15 14:53,2015-7-15 14:53,2015-7-20 10:25,12319上报,华夏东路孙环路
512,1507H7096753,街面秩序,占道无证照经营,（催办）反映该处现有乱设摊现象（3个摊位，卖衣物、鞋子），影响市容及通行，请尽快核实处理并回复。,7829.647236,-2953.588388,2015-7-12 17:19,2015-7-12 17:28,2015-7-12 17:28,2015-7-13 16:56,12319上报,樱花路292号门口
513,1507H7082069,街面秩序,占道无证照经营,反映该处每天09:00到21:00有10多个设摊，影响市容通行及周边居民生活。该问题已反映多时，但至今未见问题有所改善。7月8日投诉后得到职能部门答复称，该处是属于商城物业管理范围，属于历史遗留问题。但反映人称此处不属于物业管理范围，故望相关部门尽快核实处理并回复。,21606.3701,-4327.96007,2015-7-10 13:49,2015-7-10 14:05,2015-7-10 14:05,2015-7-14 15:44,12319上报,川沙路4889弄靠近（潮人商城门口）
514,1507H7166165,街面秩序,占道无证照经营,反映上述地址现有乱设摊现象（三轮车设摊，卖烧烤），请速核实处理。（信息保密）,4409.708961,-8663.188138,2015-7-15 16:14,2015-7-15 16:16,2015-7-15 16:16,2015-7-16 14:25,12319上报,东明路杨南路
515,1507H7165078,街面秩序,占道无证照经营,【信息保密，无需回复】反映该处现有乱设摊（卡车设摊卖西瓜），影响出行，对此不满，要求尽快到现场，请核实处理。（信息保密、不需回复）,4409.708961,-8663.188138,2015-7-15 15:31,2015-7-15 15:36,2015-7-15 15:36,2015-7-16 14:24,12319上报,东明路杨南路
516,1507H7086741,街面秩序,占道无证照经营,（无需回复，信息保密）反映该处每天07：30至19：00有十几辆卖水果车辆，影响周边居民正常生活，反映人称该处属三林镇管理，请核实处理。,3323.460511,-9243.004618,2015-7-10 16:32,2015-7-10 16:46,2015-7-10 16:46,2015-7-13 14:23,12319上报,华夏西路（东明路到杨高南路）
517,1507H7118098,街面秩序,占道无证照经营,（信息保密，无需回复）反映该处每天17:00-03:00有乱设摊现象（夜排档和烧烤）影响居民生活，对此不满，请核实处理。（信息保密，无需回复）,9250.555173,2206.461408,2015-7-13 15:43,2015-7-13 15:46,2015-7-13 15:46,2015-7-17 15:17,12319上报,博山东路459弄
518,1507H7130470,街面秩序,占道无证照经营,（信息保密，无需回复）反映该处每天全天有大量设摊现象（卖家禽、水果等等），影响通行和环境卫生，对此不满，请核实处理（信息保密，无需回复）,4159.398688,551.1393269,2015-7-14 9:55,2015-7-14 10:19,2015-7-14 10:19,2015-7-14 16:52,12319上报,浦东大道140弄26号门口
519,1507H7151696,环卫市容,暴露垃圾,反映该处现有混合垃圾堆积，影响居民生活，而该问题反映至今，相关单位未处理未联系，对此不满，请尽快核实处理并回复。,12049.11505,-24425.40204,2015-7-15 9:08,2015-7-15 9:18,2015-7-15 9:18,2015-7-20 16:54,12319上报,梅园沙北新村51号
520,1507H7115991,街面秩序,占道无证照经营,反映该处每天全天有人设摊收废品（收家具），影响周边环境，对此不满，请核实处理并回复。,11134.24259,13491.61375,2015-7-13 14:43,2015-7-13 14:46,2015-7-13 14:46,2015-7-17 10:05,12319上报,港城路1315号(门口)
521,1507H7143106,街面秩序,占道无证照经营,反映上述地址现有乱设摊现象，油烟扰民，请速核实处理。（信息保密）,15861.23473,-3931.651909,2015-7-14 22:14,2015-7-14 23:03,2015-7-15 10:31,2015-7-17 13:23,12319上报,张东路张衡路
522,1507H7231449,环卫市容,跨门营业,反映该处公厕是21：00关门，但06月19日工作人员20：00就关门，对此不满，请核实处理并回复。,0,0,2015-7-19 20:25,2015-7-19 21:32,2015-7-19 21:32,2015-7-21 15:26,12319上报,浦星公路川六公路
523,1507H7160499,街面秩序,占道无证照经营,【无需回复】反映上述地址现有乱设摊现象，请尽快核实处理。,10173.42004,-18576.47088,2015-7-15 13:25,2015-7-15 13:36,2015-7-15 13:36,2015-7-16 14:24,12319上报,下盐路康新公路
524,1507H7222024,街面秩序,占道无证照经营,反映该处每天08:00-13：00有2个乱设摊现象（卖活禽），请速核实处理并回复。,0,0,2015-7-18 9:43,2015-7-18 9:48,2015-7-18 9:48,2015-7-21 11:29,12319上报,杭湾路水闸附近
525,1507H7133325,环卫市容,暴露垃圾,（信息保密，无需回复）反映有人将装修后的建筑垃圾堆放在该处，导致非机动车无法停放，对此不满，请尽快核实处理,8145.45338,-4783.655686,2015-7-14 11:32,2015-7-14 11:34,2015-7-14 11:34,2015-7-16 15:37,12319上报,芳芯路210弄48号对面的非机动车指定停放点
526,1507H7191808,街面秩序,占道无证照经营,【信息保密，无需回复】反映上述地址现有乱设摊现象（16:30到22:30），请速核实处理。（信息保密不需回复）,4409.708961,-8663.188138,2015-7-16 16:49,2015-7-16 16:50,2015-7-16 16:50,2015-7-17 15:40,12319上报,东明路杨南路
527,1507H7231106,街面秩序,占道无证照经营,【无需回复】反映上述地址每天22:00到05:00，存在一个乱设摊卖食物，反映人表示至今未处理，请速核实处理（信息保密不需回复）,5061.059905,-2403.849988,2015-7-19 17:37,2015-7-19 17:38,2015-7-19 17:38,2015-7-20 15:57,12319上报,蓝村路508号左右
528,1507H7223500,街面秩序,占道无证照经营,（信息保密、不需回复）。（催办）反映该处每天09:00~23:00有一个乱设摊（卖水果），严重影响周围居民出行，而该问题反映至今，相关单位虽到场处理，但力度不足，城管处理之后乱设摊还是出现了，对此表示极度不满，请速核实处理（信息保密、不需回复）。,10846.2842,1534.364384,2015-7-18 13:19,2015-7-18 13:55,2015-7-18 13:55,2015-7-23 15:17,12319上报,银山路枣庄路口
529,1507H7191500,环卫市容,暴露垃圾,【无需回复】反映该处高压电线下的绿化带处有建筑垃圾堆积，请核实处理并回复。回复电话：13816313028,9689.937797,-1976.045763,2015-7-16 16:31,2015-7-16 16:52,2015-7-16 16:52,,12319上报,花木路罗山路汤臣高尔夫校服西大门
530,1507H7142505,街面秩序,占道无证照经营,反映上述地址现有乱设摊现象（三轮车设摊，卖烧烤），请速核实处理。（信息保密）,4409.708961,-8663.188138,2015-7-14 20:38,2015-7-14 20:43,2015-7-14 20:43,2015-7-16 7:29,12319上报,东明路杨南路
531,1507H7232018,街面秩序,占道无证照经营,反映上述地址现有大量乱设摊现象，影响通行，请尽快核实处理并回复。,0,0,2015-7-20 5:25,2015-7-20 5:32,2015-7-20 5:32,2015-7-23 9:54,12319上报,向阳路234号
532,1507H7232402,街面秩序,占道无证照经营,反映该处现有大量乱设摊，影响车辆通行，要求长效管理，请核实处理并回复。,0,0,2015-7-20 7:07,2015-7-20 7:16,2015-7-20 7:16,2015-7-22 10:42,12319上报,曹路镇医院北路近卫生服务中心
533,1507H7232765,街面秩序,占道无证照经营,【无需回复】反映该处每天04:00至08:30及16:00至18:00有2个摊位乱设摊现象，对此不满，请核实处理。（信息保密，不回复）,0,0,2015-7-20 7:37,2015-7-20 7:45,2015-7-20 7:45,2015-7-20 10:00,12319上报,航园路沪南公路
534,1507H7232840,街面秩序,占道无证照经营,反映该处有乱设摊现象。（卖菜等摊位），严重影响车辆通行，请核实处理并回复。,12515.6747,152.8783346,2015-7-20 7:43,2015-7-20 7:46,2015-7-20 7:46,2015-7-22 9:47,12319上报,金桥路2552弄
535,1507H7145793,街面秩序,占道无证照经营,反映该处有大量乱设摊，占用道路影响通行，对此表示不满，请速核实处理。,10280.62186,4455.276835,2015-7-15 6:32,2015-7-15 6:51,2015-7-15 6:51,2015-7-15 9:25,12319上报,莱阳路201弄
536,1507H7145844,街面秩序,占道无证照经营,反映该处每天03:00--07:00有大量乱设摊现象，占用道路影响通行，对此表示不满，请速核实处理。（无需回复）,27868.53058,-21157.22937,2015-7-15 6:38,2015-7-15 6:50,2015-7-15 6:50,2015-7-15 16:10,12319上报,南团公路沪南公路南
537,1507H7145558,街面秩序,占道无证照经营,反映上述地址每天04:00以后有大量乱设摊（至少50--60个摊位），影响通行，请尽快核实处理并回复。,26891.39487,-20727.63135,2015-7-15 6:02,2015-7-15 6:08,2015-7-15 6:08,2015-7-15 11:13,12319上报,向阳路234号
538,1507H7194151,环卫市容,跨门营业,反映该处现在有跨门营业现象，请核实处理并回复。,0,0,2015-7-16 22:07,2015-7-16 22:37,2015-7-16 22:37,2015-7-17 14:50,12319上报,东书房路390弄北面
539,1507H7224228,街面秩序,占道无证照经营,反映该处每天12:00~20:00有大量乱设摊（卖菜等），影响市容及居民出行，反映至今非但没有改善反而越来越严重，且其中有一卖菜的还称与城管是有关系的，请处理并回复。,4616.034209,-2847.894212,2015-7-18 14:55,2015-7-18 15:22,2015-7-18 15:22,2015-7-21 15:52,12319上报,龙阳路靠近杨高南路(立交下桥洞内)
540,1507H7277853,环卫市容,跨门营业,反映该处饭店每天20:00以后跨门营业，影响通行，对此不满，请核实处理并回复。要求严肃处理。,3730.622112,-3925.771077,2015-7-21 21:50,2015-7-21 21:52,2015-7-21 21:52,2015-7-24 16:53,12319上报,浦东南路胶南路
541,1507H7302562,街面秩序,占道无证照经营,【无需回复】反映该处有人设摊贩卖鞋子（还吆喝），此影响市容和周边居民生活。且设摊户隔三差五来，故其要求城管尽快到现场取缔。故望相关部门尽快核实处理。（信息保密 无需回复）,12565.42906,4810.906115,2015-7-23 7:43,2015-7-23 7:49,2015-7-23 7:49,2015-7-24 8:51,12319上报,博兴路1676弄门口
542,1507H7252604,环卫市容,跨门营业,反映该处饭店每天20:00以后跨门营业，影响通行，对此不满，请核实处理并回复。,3730.622112,-3925.771077,2015-7-20 19:44,2015-7-20 20:25,2015-7-20 20:25,2015-7-22 11:39,12319上报,浦东南路胶南路
543,1507H7252605,环卫市容,跨门营业,反映该处有一个跨门营业（卖烧烤），占用人行道，反映人称城管人员每天在烧烤摊吃烧烤，对此表示不满，请核实处理。（信息保密，无需回复）,14018.8182,11108.71232,2015-7-20 19:44,2015-7-20 20:26,2015-7-20 20:26,2015-7-22 13:50,12319上报,高东新路靠近外环
544,1507H7277525,街面秩序,占道无证照经营,反映该处有大量乱设摊，严重扰民，对此表示不满，请核实处理。（信息保密，不需要回复）,18859.63292,-4517.156087,2015-7-21 19:26,2015-7-21 19:27,2015-7-21 19:27,2015-7-24 9:41,12319上报,德川路万家新天地入口
545,1507H7275402,街面秩序,占道无证照经营,反映该处现有一个设摊（卖水果），对此表示不满，请尽快核实处理并回复。,4488.589729,1067.190687,2015-7-21 17:08,2015-7-21 17:33,2015-7-21 17:33,2015-7-22 7:40,12319上报,东方路8号
546,1507H7342898,街面秩序,占道无证照经营,（无需回复信息保密）反映该处现有大量乱设摊（卖鱼和蔬菜等），影响车辆通行，请核实处理。无需回复信息保密,32972.93408,-29211.34547,2015-7-26 7:59,2015-7-26 8:02,2015-7-26 8:02,2015-7-27 14:36,12319上报,万和路振万路
547,1507H7278439,街面秩序,占道无证照经营,反映该处现有大量的乱设摊（卡车设摊卖蔬菜、水果等），影响市容及通行，对此不满，请核实处理并回复。,27868.53058,-21157.22937,2015-7-22 6:26,2015-7-22 6:42,2015-7-22 6:42,2015-7-24 10:29,12319上报,南团公路沪南公路
548,1507H7247207,环卫市容,跨门营业,反映该处现在有跨门营业现象，反映至今未果，后有相关部门给其电话称会至现场处理，但至今相关部门没到现场查实，对此不满，请核实处理并回复。,6066.465922,-7634.760169,2015-7-20 14:08,2015-7-20 14:14,2015-7-20 14:14,2015-7-20 16:00,12319上报,东书房路390弄北面
